{
  "_meta": {
    "description": "REST API server configuration for Win11Forge",
    "version": "3.6.8",
    "author": "Julien Bombled",
    "lastUpdated": "2026-01-19"
  },
  "port": 5170,
  "host": "localhost",
  "requestTimeoutMs": 30000,
  "maxConcurrentRequests": 10,
  "enableCors": false,
  "logRequests": true,
  "endpoints": {
    "enabled": [
      "/api/version",
      "/api/profiles",
      "/api/applications",
      "/api/status",
      "/api/deploy",
      "/api/rollback",
      "/api/cache/stats",
      "/api/csrf-token"
    ]
  },
  "security": {
    "localhostOnly": true,
    "requireAuthentication": true,
    "authenticationMethod": "apiKey",
    "apiKeyHeader": "X-API-Key",
    "csrf": {
      "enabled": true,
      "tokenHeader": "X-CSRF-Token",
      "tokenTtlMinutes": 60,
      "description": "CSRF tokens required for POST/PUT/DELETE requests. Get token from /api/csrf-token endpoint."
    },
    "rateLimiting": {
      "enabled": true,
      "maxRequestsPerMinute": 60,
      "maxRequestsPerHour": 1000,
      "maxFailedAuthPerHour": 10,
      "blockDurationMinutes": 60
    },
    "notes": "API requires authentication via X-API-Key header. CSRF protection and rate limiting are enabled by default."
  },
  "apiKeys": {
    "description": "API keys for authentication. Keys should be 32+ characters. Generate new keys using New-ApiKey cmdlet.",
    "securityWarning": "NEVER commit real API keys to version control. Use New-ApiKey to generate secure keys at runtime.",
    "keys": [
      {
        "id": "example-disabled",
        "key": "EXAMPLE-ONLY-GENERATE-NEW-KEY-WITH-New-ApiKey",
        "description": "Example key template - DISABLED by default. Use New-ApiKey to create secure keys.",
        "permissions": ["read"],
        "enabled": false,
        "createdAt": "2026-01-19",
        "expiresAt": null
      }
    ],
    "publicEndpoints": [
      "/api/version"
    ]
  }
}
